<?xml version="1.0"?>
<!DOCTYPE WorkFlow_log SYSTEM "http://www.tm.tue.nl/it/research/workflow/mining/WorkFlow_log.dtd">
<WorkFlow_log><source program="staffware"/><process id="main_process"><case id="case_0"><log_line><task_name>Case start</task_name><event kind="normal"/><date>12-04-2002</date><time>15:16</time></log_line><log_line><task_name>START</task_name><event kind="schedule"/><date>12-04-2002</date><time>15:16</time></log_line><log_line><task_name>START</task_name><event kind="complete"/><date>12-04-2002</date><time>15:16</time></log_line><log_line><task_name>TASKA</task_name><event kind="schedule"/><date>12-04-2002</date><time>15:16</time></log_line><log_line><task_name>TASKA</task_name><event kind="complete"/><date>12-04-2002</date><time>15:16</time></log_line><log_line><task_name>TASKE</task_name><event kind="schedule"/><date>12-04-2002</date><time>15:17</time></log_line><log_line><task_name>TASKC</task_name><event kind="schedule"/><date>12-04-2002</date><time>15:17</time></log_line><log_line><task_name>TASKC</task_name><event kind="complete"/><date>12-04-2002</date><time>15:17</time></log_line><log_line><task_name>TASKE</task_name><event kind="complete"/><date>12-04-2002</date><time>15:17</time></log_line><log_line><task_name>TASKG</task_name><event kind="schedule"/><date>12-04-2002</date><time>15:17</time></log_line><log_line><task_name>TASKG</task_name><event kind="complete"/><date>12-04-2002</date><time>15:17</time></log_line><log_line><task_name>Case termination</task_name><event kind="normal"/><date>12-04-2002</date><time>15:17</time></log_line></case><case id="case_1"><log_line><task_name>Case start</task_name><event kind="normal"/><date>12-04-2002</date><time>15:16</time></log_line><log_line><task_name>START</task_name><event kind="schedule"/><date>12-04-2002</date><time>15:16</time></log_line><log_line><task_name>START</task_name><event kind="complete"/><date>12-04-2002</date><time>15:16</time></log_line><log_line><task_name>TASKA</task_name><event kind="schedule"/><date>12-04-2002</date><time>15:16</time></log_line><log_line><task_name>TASKA</task_name><event kind="complete"/><date>12-04-2002</date><time>15:16</time></log_line><log_line><task_name>TASKE</task_name><event kind="schedule"/><date>12-04-2002</date><time>15:17</time></log_line><log_line><task_name>TASKC</task_name><event kind="schedule"/><date>12-04-2002</date><time>15:17</time></log_line><log_line><task_name>TASKE</task_name><event kind="complete"/><date>12-04-2002</date><time>15:17</time></log_line><log_line><task_name>TASKC</task_name><event kind="complete"/><date>12-04-2002</date><time>15:17</time></log_line><log_line><task_name>TASKG</task_name><event kind="schedule"/><date>12-04-2002</date><time>15:17</time></log_line><log_line><task_name>TASKG</task_name><event kind="complete"/><date>12-04-2002</date><time>15:17</time></log_line><log_line><task_name>Case termination</task_name><event kind="normal"/><date>12-04-2002</date><time>15:17</time></log_line></case><case id="case_2"><log_line><task_name>Case start</task_name><event kind="normal"/><date>12-04-2002</date><time>15:16</time></log_line><log_line><task_name>START</task_name><event kind="schedule"/><date>12-04-2002</date><time>15:16</time></log_line><log_line><task_name>START</task_name><event kind="complete"/><date>12-04-2002</date><time>15:16</time></log_line><log_line><task_name>TASKB</task_name><event kind="schedule"/><date>12-04-2002</date><time>15:16</time></log_line><log_line><task_name>TASKB</task_name><event kind="complete"/><date>12-04-2002</date><time>15:17</time></log_line><log_line><task_name>TASKD</task_name><event kind="schedule"/><date>12-04-2002</date><time>15:17</time></log_line><log_line><task_name>TASKF</task_name><event kind="schedule"/><date>12-04-2002</date><time>15:17</time></log_line><log_line><task_name>TASKD</task_name><event kind="complete"/><date>12-04-2002</date><time>15:17</time></log_line><log_line><task_name>TASKF</task_name><event kind="complete"/><date>12-04-2002</date><time>15:17</time></log_line><log_line><task_name>TASKG</task_name><event kind="schedule"/><date>12-04-2002</date><time>15:17</time></log_line><log_line><task_name>TASKG</task_name><event kind="complete"/><date>12-04-2002</date><time>15:17</time></log_line><log_line><task_name>Case termination</task_name><event kind="normal"/><date>12-04-2002</date><time>15:17</time></log_line></case><case id="case_3"><log_line><task_name>Case start</task_name><event kind="normal"/><date>12-04-2002</date><time>15:16</time></log_line><log_line><task_name>START</task_name><event kind="schedule"/><date>12-04-2002</date><time>15:16</time></log_line><log_line><task_name>START</task_name><event kind="complete"/><date>12-04-2002</date><time>15:16</time></log_line><log_line><task_name>TASKA</task_name><event kind="schedule"/><date>12-04-2002</date><time>15:16</time></log_line><log_line><task_name>TASKA</task_name><event kind="complete"/><date>12-04-2002</date><time>15:17</time></log_line><log_line><task_name>TASKE</task_name><event kind="schedule"/><date>12-04-2002</date><time>15:17</time></log_line><log_line><task_name>TASKC</task_name><event kind="schedule"/><date>12-04-2002</date><time>15:17</time></log_line><log_line><task_name>TASKE</task_name><event kind="complete"/><date>12-04-2002</date><time>15:17</time></log_line><log_line><task_name>TASKC</task_name><event kind="complete"/><date>12-04-2002</date><time>15:17</time></log_line><log_line><task_name>TASKG</task_name><event kind="schedule"/><date>12-04-2002</date><time>15:17</time></log_line><log_line><task_name>TASKG</task_name><event kind="complete"/><date>12-04-2002</date><time>15:17</time></log_line><log_line><task_name>Case termination</task_name><event kind="normal"/><date>12-04-2002</date><time>15:18</time></log_line></case><case id="case_4"><log_line><task_name>Case start</task_name><event kind="normal"/><date>12-04-2002</date><time>15:16</time></log_line><log_line><task_name>START</task_name><event kind="schedule"/><date>12-04-2002</date><time>15:16</time></log_line><log_line><task_name>START</task_name><event kind="complete"/><date>12-04-2002</date><time>15:16</time></log_line><log_line><task_name>TASKB</task_name><event kind="schedule"/><date>12-04-2002</date><time>15:16</time></log_line><log_line><task_name>TASKB</task_name><event kind="complete"/><date>12-04-2002</date><time>15:17</time></log_line><log_line><task_name>TASKD</task_name><event kind="schedule"/><date>12-04-2002</date><time>15:17</time></log_line><log_line><task_name>TASKF</task_name><event kind="schedule"/><date>12-04-2002</date><time>15:17</time></log_line><log_line><task_name>TASKF</task_name><event kind="complete"/><date>12-04-2002</date><time>15:17</time></log_line><log_line><task_name>TASKD</task_name><event kind="complete"/><date>12-04-2002</date><time>15:17</time></log_line><log_line><task_name>TASKG</task_name><event kind="schedule"/><date>12-04-2002</date><time>15:17</time></log_line><log_line><task_name>TASKG</task_name><event kind="complete"/><date>12-04-2002</date><time>15:18</time></log_line><log_line><task_name>Case termination</task_name><event kind="normal"/><date>12-04-2002</date><time>15:18</time></log_line></case></process></WorkFlow_log>
