<?xml version="1.0"?>
<!DOCTYPE WorkFlow_log SYSTEM "http://www.tm.tue.nl/it/research/workflow/mining/WorkFlow_log.dtd">
<WorkFlow_log><source program="staffware"/><process id="main_process"><case id="case_0"><log_line><task_name>Case start</task_name><event kind="normal"/><date>16-04-2002</date><time>15:20</time></log_line><log_line><task_name>TASKA</task_name><event kind="schedule"/><date>16-04-2002</date><time>15:20</time></log_line><log_line><task_name>TASKI</task_name><event kind="schedule"/><date>16-04-2002</date><time>15:20</time></log_line><log_line><task_name>TASKI</task_name><event kind="complete"/><date>16-04-2002</date><time>15:20</time></log_line><log_line><task_name>TASKC</task_name><event kind="schedule"/><date>16-04-2002</date><time>15:21</time></log_line><log_line><task_name>TASKC</task_name><event kind="complete"/><date>16-04-2002</date><time>15:22</time></log_line><log_line><task_name>TASKA</task_name><event kind="complete"/><date>16-04-2002</date><time>15:22</time></log_line><log_line><task_name>TASKJ</task_name><event kind="schedule"/><date>16-04-2002</date><time>15:22</time></log_line><log_line><task_name>TASKJ</task_name><event kind="complete"/><date>16-04-2002</date><time>15:22</time></log_line><log_line><task_name>Case termination</task_name><event kind="normal"/><date>16-04-2002</date><time>15:23</time></log_line></case><case id="case_1"><log_line><task_name>Case start</task_name><event kind="normal"/><date>16-04-2002</date><time>15:27</time></log_line><log_line><task_name>TASKA</task_name><event kind="schedule"/><date>16-04-2002</date><time>15:27</time></log_line><log_line><task_name>TASKI</task_name><event kind="schedule"/><date>16-04-2002</date><time>15:27</time></log_line><log_line><task_name>TASKA</task_name><event kind="complete"/><date>16-04-2002</date><time>15:27</time></log_line><log_line><task_name>TASKI</task_name><event kind="complete"/><date>16-04-2002</date><time>15:27</time></log_line><log_line><task_name>TASKJ</task_name><event kind="schedule"/><date>16-04-2002</date><time>15:27</time></log_line><log_line><task_name>TASKJ</task_name><event kind="complete"/><date>16-04-2002</date><time>15:27</time></log_line><log_line><task_name>Case termination</task_name><event kind="normal"/><date>16-04-2002</date><time>15:27</time></log_line></case><case id="case_2"><log_line><task_name>Case start</task_name><event kind="normal"/><date>16-04-2002</date><time>15:20</time></log_line><log_line><task_name>TASKA</task_name><event kind="schedule"/><date>16-04-2002</date><time>15:20</time></log_line><log_line><task_name>TASKI</task_name><event kind="schedule"/><date>16-04-2002</date><time>15:20</time></log_line><log_line><task_name>TASKC</task_name><event kind="schedule"/><date>16-04-2002</date><time>15:21</time></log_line><log_line><task_name>TASKC</task_name><event kind="complete"/><date>16-04-2002</date><time>15:21</time></log_line><log_line><task_name>TASKI</task_name><event kind="complete"/><date>16-04-2002</date><time>15:23</time></log_line><log_line><task_name>TASKA</task_name><event kind="complete"/><date>16-04-2002</date><time>15:23</time></log_line><log_line><task_name>TASKJ</task_name><event kind="schedule"/><date>16-04-2002</date><time>15:23</time></log_line><log_line><task_name>TASKJ</task_name><event kind="complete"/><date>16-04-2002</date><time>15:23</time></log_line><log_line><task_name>Case termination</task_name><event kind="normal"/><date>16-04-2002</date><time>15:24</time></log_line></case><case id="case_3"><log_line><task_name>Case start</task_name><event kind="normal"/><date>16-04-2002</date><time>15:20</time></log_line><log_line><task_name>TASKA</task_name><event kind="schedule"/><date>16-04-2002</date><time>15:20</time></log_line><log_line><task_name>TASKI</task_name><event kind="schedule"/><date>16-04-2002</date><time>15:20</time></log_line><log_line><task_name>TASKC</task_name><event kind="schedule"/><date>16-04-2002</date><time>15:21</time></log_line><log_line><task_name>TASKC</task_name><event kind="complete"/><date>16-04-2002</date><time>15:21</time></log_line><log_line><task_name>TASKA</task_name><event kind="complete"/><date>16-04-2002</date><time>15:23</time></log_line><log_line><task_name>TASKI</task_name><event kind="complete"/><date>16-04-2002</date><time>15:23</time></log_line><log_line><task_name>TASKJ</task_name><event kind="schedule"/><date>16-04-2002</date><time>15:23</time></log_line><log_line><task_name>TASKJ</task_name><event kind="complete"/><date>16-04-2002</date><time>15:24</time></log_line><log_line><task_name>Case termination</task_name><event kind="normal"/><date>16-04-2002</date><time>15:24</time></log_line></case><case id="case_4"><log_line><task_name>Case start</task_name><event kind="normal"/><date>16-04-2002</date><time>15:27</time></log_line><log_line><task_name>TASKA</task_name><event kind="schedule"/><date>16-04-2002</date><time>15:27</time></log_line><log_line><task_name>TASKI</task_name><event kind="schedule"/><date>16-04-2002</date><time>15:27</time></log_line><log_line><task_name>TASKI</task_name><event kind="complete"/><date>16-04-2002</date><time>15:27</time></log_line><log_line><task_name>TASKA</task_name><event kind="complete"/><date>16-04-2002</date><time>15:27</time></log_line><log_line><task_name>TASKJ</task_name><event kind="schedule"/><date>16-04-2002</date><time>15:27</time></log_line><log_line><task_name>TASKJ</task_name><event kind="complete"/><date>16-04-2002</date><time>15:27</time></log_line><log_line><task_name>Case termination</task_name><event kind="normal"/><date>16-04-2002</date><time>15:27</time></log_line></case></process></WorkFlow_log>
