<?xml version="1.0"?>
<!DOCTYPE WorkFlow_log SYSTEM "http://www.tm.tue.nl/it/research/workflow/mining/WorkFlow_log.dtd">
<WorkFlow_log><source program="staffware"/><process id="main_process"><case id="case_0"><log_line><task_name>Case start</task_name><event kind="normal"/><date>18-04-2002</date><time>09:05</time></log_line><log_line><task_name>A</task_name><event kind="schedule"/><date>18-04-2002</date><time>09:05</time></log_line><log_line><task_name>A</task_name><event kind="complete"/><date>18-04-2002</date><time>09:05</time></log_line><log_line><task_name>B</task_name><event kind="schedule"/><date>18-04-2002</date><time>09:05</time></log_line><log_line><task_name>B</task_name><event kind="complete"/><date>18-04-2002</date><time>09:05</time></log_line><log_line><task_name>D</task_name><event kind="schedule"/><date>18-04-2002</date><time>09:05</time></log_line><log_line><task_name>E</task_name><event kind="schedule"/><date>18-04-2002</date><time>09:05</time></log_line><log_line><task_name>D</task_name><event kind="complete"/><date>18-04-2002</date><time>09:06</time></log_line><log_line><task_name>E</task_name><event kind="complete"/><date>18-04-2002</date><time>09:06</time></log_line><log_line><task_name>G</task_name><event kind="schedule"/><date>18-04-2002</date><time>09:06</time></log_line><log_line><task_name>G</task_name><event kind="complete"/><date>18-04-2002</date><time>09:06</time></log_line><log_line><task_name>I</task_name><event kind="schedule"/><date>18-04-2002</date><time>09:06</time></log_line><log_line><task_name>I</task_name><event kind="complete"/><date>18-04-2002</date><time>09:06</time></log_line><log_line><task_name>Case termination</task_name><event kind="normal"/><date>18-04-2002</date><time>09:06</time></log_line></case><case id="case_1"><log_line><task_name>Case start</task_name><event kind="normal"/><date>18-04-2002</date><time>09:05</time></log_line><log_line><task_name>A</task_name><event kind="schedule"/><date>18-04-2002</date><time>09:05</time></log_line><log_line><task_name>A</task_name><event kind="complete"/><date>18-04-2002</date><time>09:05</time></log_line><log_line><task_name>B</task_name><event kind="schedule"/><date>18-04-2002</date><time>09:05</time></log_line><log_line><task_name>B</task_name><event kind="complete"/><date>18-04-2002</date><time>09:05</time></log_line><log_line><task_name>D</task_name><event kind="schedule"/><date>18-04-2002</date><time>09:05</time></log_line><log_line><task_name>E</task_name><event kind="schedule"/><date>18-04-2002</date><time>09:05</time></log_line><log_line><task_name>E</task_name><event kind="complete"/><date>18-04-2002</date><time>09:06</time></log_line><log_line><task_name>D</task_name><event kind="complete"/><date>18-04-2002</date><time>09:06</time></log_line><log_line><task_name>G</task_name><event kind="schedule"/><date>18-04-2002</date><time>09:06</time></log_line><log_line><task_name>G</task_name><event kind="complete"/><date>18-04-2002</date><time>09:06</time></log_line><log_line><task_name>I</task_name><event kind="schedule"/><date>18-04-2002</date><time>09:06</time></log_line><log_line><task_name>I</task_name><event kind="complete"/><date>18-04-2002</date><time>09:06</time></log_line><log_line><task_name>Case termination</task_name><event kind="normal"/><date>18-04-2002</date><time>09:07</time></log_line></case><case id="case_2"><log_line><task_name>Case start</task_name><event kind="normal"/><date>18-04-2002</date><time>09:05</time></log_line><log_line><task_name>A</task_name><event kind="schedule"/><date>18-04-2002</date><time>09:05</time></log_line><log_line><task_name>A</task_name><event kind="complete"/><date>18-04-2002</date><time>09:05</time></log_line><log_line><task_name>C</task_name><event kind="schedule"/><date>18-04-2002</date><time>09:05</time></log_line><log_line><task_name>C</task_name><event kind="complete"/><date>18-04-2002</date><time>09:05</time></log_line><log_line><task_name>F</task_name><event kind="schedule"/><date>18-04-2002</date><time>09:05</time></log_line><log_line><task_name>E</task_name><event kind="schedule"/><date>18-04-2002</date><time>09:05</time></log_line><log_line><task_name>E</task_name><event kind="complete"/><date>18-04-2002</date><time>09:06</time></log_line><log_line><task_name>F</task_name><event kind="complete"/><date>18-04-2002</date><time>09:06</time></log_line><log_line><task_name>H</task_name><event kind="schedule"/><date>18-04-2002</date><time>09:06</time></log_line><log_line><task_name>H</task_name><event kind="complete"/><date>18-04-2002</date><time>09:06</time></log_line><log_line><task_name>I</task_name><event kind="schedule"/><date>18-04-2002</date><time>09:06</time></log_line><log_line><task_name>I</task_name><event kind="complete"/><date>18-04-2002</date><time>09:06</time></log_line><log_line><task_name>Case termination</task_name><event kind="normal"/><date>18-04-2002</date><time>09:07</time></log_line></case><case id="case_3"><log_line><task_name>Case start</task_name><event kind="normal"/><date>18-04-2002</date><time>09:05</time></log_line><log_line><task_name>A</task_name><event kind="schedule"/><date>18-04-2002</date><time>09:05</time></log_line><log_line><task_name>A</task_name><event kind="complete"/><date>18-04-2002</date><time>09:05</time></log_line><log_line><task_name>C</task_name><event kind="schedule"/><date>18-04-2002</date><time>09:05</time></log_line><log_line><task_name>C</task_name><event kind="complete"/><date>18-04-2002</date><time>09:05</time></log_line><log_line><task_name>F</task_name><event kind="schedule"/><date>18-04-2002</date><time>09:05</time></log_line><log_line><task_name>E</task_name><event kind="schedule"/><date>18-04-2002</date><time>09:05</time></log_line><log_line><task_name>F</task_name><event kind="complete"/><date>18-04-2002</date><time>09:06</time></log_line><log_line><task_name>E</task_name><event kind="complete"/><date>18-04-2002</date><time>09:06</time></log_line><log_line><task_name>H</task_name><event kind="schedule"/><date>18-04-2002</date><time>09:06</time></log_line><log_line><task_name>H</task_name><event kind="complete"/><date>18-04-2002</date><time>09:06</time></log_line><log_line><task_name>I</task_name><event kind="schedule"/><date>18-04-2002</date><time>09:06</time></log_line><log_line><task_name>I</task_name><event kind="complete"/><date>18-04-2002</date><time>09:07</time></log_line><log_line><task_name>Case termination</task_name><event kind="normal"/><date>18-04-2002</date><time>09:07</time></log_line></case><case id="case_4"><log_line><task_name>Case start</task_name><event kind="normal"/><date>18-04-2002</date><time>13:47</time></log_line><log_line><task_name>A</task_name><event kind="schedule"/><date>18-04-2002</date><time>13:47</time></log_line><log_line><task_name>A</task_name><event kind="complete"/><date>18-04-2002</date><time>13:49</time></log_line><log_line><task_name>C</task_name><event kind="schedule"/><date>18-04-2002</date><time>13:49</time></log_line><log_line><task_name>C</task_name><event kind="complete"/><date>18-04-2002</date><time>13:53</time></log_line><log_line><task_name>F</task_name><event kind="schedule"/><date>18-04-2002</date><time>13:53</time></log_line><log_line><task_name>E</task_name><event kind="schedule"/><date>18-04-2002</date><time>13:53</time></log_line><log_line><task_name>E</task_name><event kind="complete"/><date>18-04-2002</date><time>13:56</time></log_line><log_line><task_name>F</task_name><event kind="complete"/><date>18-04-2002</date><time>13:57</time></log_line><log_line><task_name>H</task_name><event kind="schedule"/><date>18-04-2002</date><time>13:57</time></log_line><log_line><task_name>H</task_name><event kind="complete"/><date>18-04-2002</date><time>13:59</time></log_line><log_line><task_name>I</task_name><event kind="schedule"/><date>18-04-2002</date><time>13:59</time></log_line><log_line><task_name>I</task_name><event kind="complete"/><date>18-04-2002</date><time>14:04</time></log_line><log_line><task_name>Case termination</task_name><event kind="normal"/><date>18-04-2002</date><time>09:07</time></log_line></case><case id="case_5"><log_line><task_name>Case start</task_name><event kind="normal"/><date>18-04-2002</date><time>13:48</time></log_line><log_line><task_name>A</task_name><event kind="schedule"/><date>18-04-2002</date><time>13:48</time></log_line><log_line><task_name>A</task_name><event kind="complete"/><date>18-04-2002</date><time>13:48</time></log_line><log_line><task_name>B</task_name><event kind="schedule"/><date>18-04-2002</date><time>13:48</time></log_line><log_line><task_name>B</task_name><event kind="complete"/><date>18-04-2002</date><time>13:53</time></log_line><log_line><task_name>D</task_name><event kind="schedule"/><date>18-04-2002</date><time>13:53</time></log_line><log_line><task_name>E</task_name><event kind="schedule"/><date>18-04-2002</date><time>13:53</time></log_line><log_line><task_name>D</task_name><event kind="complete"/><date>18-04-2002</date><time>13:56</time></log_line><log_line><task_name>E</task_name><event kind="complete"/><date>18-04-2002</date><time>14:10</time></log_line><log_line><task_name>G</task_name><event kind="schedule"/><date>18-04-2002</date><time>14:10</time></log_line><log_line><task_name>G</task_name><event kind="complete"/><date>18-04-2002</date><time>14:13</time></log_line><log_line><task_name>I</task_name><event kind="schedule"/><date>18-04-2002</date><time>14:13</time></log_line><log_line><task_name>I</task_name><event kind="complete"/><date>18-04-2002</date><time>14:15</time></log_line><log_line><task_name>Case termination</task_name><event kind="normal"/><date>18-04-2002</date><time>14:15</time></log_line></case></process></WorkFlow_log>
